{
  "schema_version": "0.4.0",
  "document_type": "rack_layout",
  "document_status": "proposal_for_review",
  "approval_status": "not_ratified",
  "authority": "none_until_owner_review",
  "generated_at": "2026-08-07T00:00:00Z",
  "extends": "homestead.primary.v0_3",
  "merge_target": "data/homestead_asset_register.yaml",
  "source_document": "Homestead_Digital_Twin_Software_Design_Document_v0.3.md",
  "work_queue_item": "49.4",
  "purpose": "Preliminary rack-unit, PDU-outlet, switch-port, VLAN and power-feed proposal for the primary 42U rack. The v0.3 README lists rack-unit positions and outlet assignments as deliberately unresolved, so this document is a proposal for owner and commissioning review, not a decided elevation.",
  "review_required_before_use": true,
  "supersedes": null,
  "placement_principles": [
    "Heaviest items lowest: UPS at the bottom of the rack, then power distribution, then storage and compute.",
    "Switches and the router at the top so patching, uplinks and console access stay above the heat sources.",
    "Environmental monitoring high enough that inlet and exhaust sensor leads reach the full height of the rack.",
    "Contiguous free rack units kept in one block in the middle rather than scattered, so a future chassis fits.",
    "Zero-U, door-mounted and sensor-port-powered devices consume no rack units and are listed separately.",
    "No device is placed in a rack unit that another device already claims; the layout is checked for overlap."
  ],
  "rack": {
    "rack_asset_id": "it.rack.power_container.01",
    "rack_unit_count": 42,
    "rack_unit_count_source": "register_property_u_height",
    "rack_unit_numbering": "bottom_to_top_unit_1_is_lowest",
    "open_fields": [
      "rack_make_model",
      "rail_type",
      "cable_management_plan",
      "blanking_panel_plan",
      "cooling_airflow"
    ]
  },
  "power_feeds": [
    {
      "feed_id": "A",
      "upstream_asset_id": "energy.ups.rack_01.01",
      "description": "UPS-backed feed. The only feed with an identified upstream asset in the register.",
      "data_status": "derived_from_register",
      "open_fields": [
        "branch_circuit",
        "breaker_rating",
        "conductor_size"
      ]
    },
    {
      "feed_id": "B",
      "upstream_asset_id": null,
      "description": "Second source implied by the rack ATS. The register records source_b_id as TBD_secondary_source, so feed B has no upstream asset and every A_and_B assignment below is aspirational.",
      "data_status": "unresolved",
      "open_fields": [
        "feed_b_upstream_source",
        "branch_circuit",
        "breaker_rating",
        "conductor_size"
      ]
    }
  ],
  "pdus": [
    {
      "pdu_asset_id": "energy.pdu.rack_01.switched_01",
      "outlet_count": 10,
      "outlet_count_source": "register_property_outlet_count",
      "nominal_voltage_v": 120,
      "power_feed": "A",
      "upstream_asset_id": "energy.ats.rack_01.ap5442_01",
      "upstream_basis": "proposed_fed_from_rack_ats_output",
      "outlets": [
        {
          "outlet": 1,
          "assigned_asset_id": "it.server.rack_01.r740xd_01",
          "purpose": "primary_power_cord",
          "status": "preliminary_assignment"
        },
        {
          "outlet": 2,
          "assigned_asset_id": "it.server.rack_01.r740xd_01",
          "purpose": "redundant_power_cord",
          "status": "reserved_pending_psu_confirmation"
        },
        {
          "outlet": 3,
          "assigned_asset_id": "it.server.rack_01.t7820_01",
          "purpose": "primary_power_cord",
          "status": "preliminary_assignment"
        },
        {
          "outlet": 4,
          "assigned_asset_id": "it.storage_array.rack_01.sc200_01",
          "purpose": "primary_power_cord",
          "status": "preliminary_assignment"
        },
        {
          "outlet": 5,
          "assigned_asset_id": "it.storage_array.rack_01.sc200_01",
          "purpose": "redundant_power_cord",
          "status": "reserved_pending_psu_confirmation"
        },
        {
          "outlet": 6,
          "assigned_asset_id": "it.storage_array.rack_01.sc200_02",
          "purpose": "primary_power_cord",
          "status": "preliminary_assignment"
        },
        {
          "outlet": 7,
          "assigned_asset_id": "it.switch.rack_01.arista_7050qx_01",
          "purpose": "primary_power_cord",
          "status": "preliminary_assignment"
        },
        {
          "outlet": 8,
          "assigned_asset_id": "it.wireless_controller.rack_01.wlc5508_01",
          "purpose": "primary_power_cord",
          "status": "preliminary_assignment"
        },
        {
          "outlet": 9,
          "assigned_asset_id": "it.environmental_monitor.rack_01.nbrk0550_01",
          "purpose": "primary_power_cord",
          "status": "preliminary_assignment"
        },
        {
          "outlet": 10,
          "assigned_asset_id": null,
          "purpose": "spare",
          "status": "spare"
        }
      ],
      "open_fields": [
        "pdu_input_plug",
        "per_outlet_current_rating",
        "ats_outlet_number"
      ],
      "notes": [
        "Per-outlet switching is the audited command path required by FR-802.",
        "Outlets 2 and 5 are held for redundant cords; releasing them requires a confirmed PSU inventory."
      ]
    },
    {
      "pdu_asset_id": "energy.pdu.rack_01.basic_01",
      "outlet_count": 8,
      "outlet_count_source": "register_property_outlet_count",
      "nominal_voltage_v": 120,
      "power_feed": "A",
      "upstream_asset_id": "energy.ups.rack_01.01",
      "upstream_basis": "proposed_fed_from_ups_output",
      "outlets": [
        {
          "outlet": 1,
          "assigned_asset_id": "it.environmental_monitor.rack_01.ap9320_01",
          "purpose": "primary_power_cord",
          "status": "preliminary_assignment"
        },
        {
          "outlet": 2,
          "assigned_asset_id": "it.environmental_monitor.rack_01.ap92200_01",
          "purpose": "primary_power_cord",
          "status": "preliminary_assignment"
        },
        {
          "outlet": 3,
          "assigned_asset_id": "security.access_controller.rack_01.ap9361_01",
          "purpose": "primary_power_cord",
          "status": "preliminary_assignment"
        },
        {
          "outlet": 4,
          "assigned_asset_id": "security.camera.rack_01.netbotz_01",
          "purpose": "primary_power_cord",
          "status": "preliminary_assignment"
        },
        {
          "outlet": 5,
          "assigned_asset_id": null,
          "purpose": "spare",
          "status": "spare"
        },
        {
          "outlet": 6,
          "assigned_asset_id": null,
          "purpose": "spare",
          "status": "spare"
        },
        {
          "outlet": 7,
          "assigned_asset_id": null,
          "purpose": "spare",
          "status": "spare"
        },
        {
          "outlet": 8,
          "assigned_asset_id": null,
          "purpose": "spare",
          "status": "spare"
        }
      ],
      "open_fields": [
        "pdu_input_plug",
        "per_outlet_current_rating"
      ],
      "notes": [
        "Basic PDU carries monitoring and access hardware that must not be remotely power-cycled by mistake."
      ]
    }
  ],
  "switch_port_plan": {
    "access_switch_asset_id": "it.switch.rack_01.catalyst_2960x_01",
    "backbone_switch_asset_id": "it.switch.rack_01.arista_7050qx_01",
    "numbering_basis": "positional_index_only",
    "interface_naming_status": "unresolved",
    "open_fields": [
      "catalyst_exact_model_suffix",
      "catalyst_port_count",
      "catalyst_interface_names",
      "arista_port_count",
      "arista_interface_names",
      "catalyst_to_arista_uplink_ports",
      "trunk_and_allowed_vlan_lists"
    ],
    "notes": [
      "Port numbers here are positional indexes, not interface names. The register already lists the exact 2960-X model suffix and port map as open fields, so no interface name is invented.",
      "VLAN membership is copied from each asset's register network block and is not proposed by this document."
    ]
  },
  "placements": [
    {
      "asset_id": "energy.ups.rack_01.01",
      "name": "APC Smart-UPS 1500",
      "asset_class": "ups",
      "register_status": "planned",
      "mount_style": "rack_unit",
      "rack_unit_start": 1,
      "rack_unit_height": 2,
      "rack_unit_height_basis": "estimated_pending_model_confirmation",
      "depth_class": "full_depth",
      "power_feed": "A",
      "power_feed_basis": "ups_is_the_origin_of_feed_a",
      "power_source_asset_id": null,
      "pdu_asset_id": null,
      "pdu_outlet": null,
      "pdu_outlet_basis": "not_applicable_upstream_of_pdus",
      "switch_asset_id": "it.switch.rack_01.catalyst_2960x_01",
      "switch_port": 1,
      "switch_port_basis": "preliminary_positional_assignment",
      "additional_switch_connections": [],
      "vlan_ids": [
        10
      ],
      "vlan_asset_ids": [
        "it.network_segment.site.vlan_10"
      ],
      "vlan_basis": "derived_from_register_network_block",
      "estimated_power_w": null,
      "power_data_status": "not_estimated",
      "heat_load_status": "not_calculated_pending_measured_load",
      "placement_status": "preliminary",
      "data_status": "estimated",
      "open_fields": [
        "rack_unit_height",
        "ups_form_factor",
        "ups_rack_or_tower_variant",
        "battery_module_weight",
        "input_branch_circuit"
      ],
      "notes": [
        "Heaviest single item; placed at the bottom of the rack per normal practice.",
        "Register records rated_w 1500 and rated_va TBD; the rack-mount variant is not confirmed, so 2U is an estimate."
      ]
    },
    {
      "asset_id": "energy.ats.rack_01.ap5442_01",
      "name": "APC Rack ATS AP5442",
      "asset_class": "ats",
      "register_status": "planned",
      "mount_style": "rack_unit",